title,price,rating,reviews,availability,source
"Smart Watch for Men Women Bluetooth Call, 1.95"" HD Touch Screen Fitness Watch with Sleep Heart Rate Monitor, 100+ Sports Modes, IP68 Waterproof Activity Trackers for Android iOS, Blue",,4.6 out of 5 stars,969 ratings,Not Available,Amazon
"Garmin Descent™ Mk3, Dive Computer and Multisport GPS Smartwatch, Fog Gray",,4.0 out of 5 stars,9 ratings,In Stock,Amazon
"Smart Watch, Smartwatch for Men Women with 24 Sport Modes, IP68 Waterproof Fitness Tracker with 24/7 Heart Rate/Sleep/SpO2 Monitor, Step Tracker, Pedometer, Activity Tracker for Android iOS",,4.8 out of 5 stars,774 ratings,Not Available,Amazon
"Smart Watch, Smartwatches for Men Women, 1.85""HD Fitness Tracker (Answer/Make Calls), 120+ Sport Modes, IP68 Waterproof Fitness Watch, Heart Rate/Sleep Monitor, Smartwatch Compatible Android iOS",,4.6 out of 5 stars,445 ratings,Not Available,Amazon
"Smart Watch(Answer/Make Calls), 1.91"" Smartwatches for Men Women, Fitness Tracker with 110+ Sport Modes, IP68 Waterproof, Heart Rate/Sleep/Spo2 Monitor, Pedometer, Activity Tracker for Android iOS",,4.8 out of 5 stars,390 ratings,Not Available,Amazon
"Military Smart Watch for Men with Blood Pressure (Answer/Make Call), Rugged Tactical Smartwatch for Android and iPhone, 10 ATM Waterproof Outdoor Sports Fitness Tracker with Heart Rate, Sleep Monitor",,4.0 out of 5 stars,"3,266 ratings",Not Available,Amazon
"Smart Watches for Women, Android Smart Watch for Phones (Make Calls), 1.85"" HD Fitness Tracker Watch with Blood Pressure/Heart Rate/Sleep Monitor, 110+ Sport Modes Fitness Watches for Women/Men",,4.2 out of 5 stars,793 ratings,Not Available,Amazon
"Military Smart Watch for Men with Call Function,Fitness Smartwatch for Android Phones and iPhone,Waterproof Fitness Tracker with Blood Oxygen/Heart Rate/Sleep/100+ Sport Modes, Watches for Men",,4.4 out of 5 stars,318 ratings,Not Available,Amazon
Smart Watch for Men Fitness Tracker: Make/Answer Call Military Smart Watches for Men Digital Mens Watches Running Waterproof Smartwatch Android Phones iPhone Samsung Compatible Heart Rate Monitor,,4.4 out of 5 stars,454 ratings,Not Available,Amazon
"Smart Watch, Fitness Tracker with Heart Rate Monitor, Blood Oxygen, Sleep Tracking, 1.5 Inch Touchscreen Smartwatch for Android iOS Swimming Waterproof Pedometer Step Calories Tracker for Women Men",,4.0 out of 5 stars,"3,254 ratings",Not Available,Amazon
"Smart Watch for Men Women, 1.96""HD Smartwatch (Answer/Make Call) with Heart Rate/Sleep Monitor/Pedometer/Spo2, 2025 New Fitness Watch 113+ Sport Modes, IP68 Waterproof Activity Tracker for Android iOS",,4.6 out of 5 stars,673 ratings,Not Available,Amazon
"Garmin Descent™ Mk3i, Dive Computer and Multisport GPS Smartwatch, Air Integration, Black",,4.2 out of 5 stars,14 ratings,In Stock,Amazon
"Smart Watch for Men Women(Answer/Make Call), 2025 New Smartwatch 1.96"" HD Fitness Watch with 110+ Sport Modes, Heart Rate, Sleep Monitor, Pedometer, IP68 Waterproof Activity Tracker for Android iOS",,4.8 out of 5 stars,360 ratings,Not Available,Amazon
"Smart Watch, 1.85"" HD Smartwatch for Men Women (Answer/Make Calls), Fitness Watch with Heart Rate/Sleep/IP68 Waterproof/120+ Sports Modes, Pedometer, Android Smart Watch for Android iOS",,4.2 out of 5 stars,507 ratings,Not Available,Amazon
Smart Watches for Women Men with Call: Fitness Trackers with 24-Hour Heart Rate SpO2 Sleep Monitor 5ATM Waterproof 120+ Sport Mode Watches for Women gift Compatible with iPhone Android Phones(3 Bands),,4.4 out of 5 stars,"1,758 ratings",Not Available,Amazon
"Smart Watch, Fitness Tracker with Heart Rate Monitor, Blood Oxygen, Sleep Tracking, 1.5 Inch Touchscreen Smartwatch for Android iOS Swimming Waterproof Pedometer Step Calories Tracker for Women Men",,4.0 out of 5 stars,"3,254 ratings",Not Available,Amazon
"Garmin Approach® S44, Essential Golf GPS Smartwatch, AMOLED Display, On-Course Features, Silver Aluminum Bezel with Twilight Silicone Band",,3.9 out of 5 stars,10 ratings,In Stock,Amazon
"Garmin vívoactive 5, Health and Fitness GPS Smartwatch, AMOLED Display, Up to 11 Days of Battery, Black",,4.4 out of 5 stars,"4,652 ratings",In Stock,Amazon
"Samsung Galaxy Watch 7 40mm Bluetooth AI Smartwatch w/Energy Score, Wellness Tips, Heart Rate Tracking, Sleep Monitor, Fitness Tracker, 2024, Cream [US Version, 1Yr Manufacturer Warranty]",,4.5 out of 5 stars,"1,875 ratings",In Stock,Amazon
"Amazfit Active 2 Smart Watch 44mm, GPS Maps with Direction, Fitness Tracker, 10 Day Battery, Sleep Monitor, 160+ Sport Modes, Water Resistant, for Android & Apple iPhone, Black Silicone",,4.7 out of 5 stars,180 ratings,In Stock,Amazon
"Smart Watch for Men Women Bluetooth Call, 1.95"" HD Touch Screen Fitness Watch with Sleep Heart Rate Monitor, 100+ Sports Modes, IP68 Waterproof Activity Trackers for Android iOS, Blue",,4.6 out of 5 stars,969 ratings,Not Available,Amazon
"Fitpolo Smart Watch for Men Women,1.8” Touchscreen, Bluetooth Call, Alexa Built-in,24/7 Heart Rate, SpO2 Monitor, Step Counting, Sleep Tracking,IP68 Waterproof Fitness Tracker Watch for Android iPhone",,4.1 out of 5 stars,"6,151 ratings",Not Available,Amazon
"Smart Watch, 1.43"" Smartwatch for Men Women (Answer/Make Call), Fitness Tracker with 110+ Sport Modes, IP68 Waterproof, Spo2, Pedometer, Heart Rate/Sleep Monitor, Activity Tracker for Android iOS",,5.0 out of 5 stars,539 ratings,Not Available,Amazon
"Fitbit Versa 4 Fitness Smartwatch with Daily Readiness, GPS, 24/7 Heart Rate, 40+ Exercise Modes, Sleep Tracking and more, Waterfall Blue/Platinum, One Size (S & L Bands Included)",,4.3 out of 5 stars,"13,909 ratings",In Stock,Amazon
"Smart Watch for Men Women, 1.96"" Smartwatch (Answer/Make Call), IP68 Waterproof Fitness Tracker, 112+ Sport Modes Smartwatches for Android iOS, Black​",,4.9 out of 5 stars,90 ratings,Not Available,Amazon
"Samsung Galaxy Watch FE 40mm Bluetooth AI Smartwatch w/Fitness Tracking, BIA Sensor, Personalized HR Zones, Heart Rate Tracker, Sleep Monitor, 2024, Black [US Version, 1Yr Manufacturer Warranty]",,4.2 out of 5 stars,620 ratings,In Stock,Amazon
Smart Watch for Men Women Fitness: Waterproof Make/Answer Call Smart Watches for Men Digital Mens Watches Running Step Tracker Smartwatch Android Phones iPhone Samsung Compatible Heart Rate Monitor,,4.4 out of 5 stars,242 ratings,Not Available,Amazon
