product_name,reviews,source
Pinkmint Men Cotton Soild Spread Collar Long Sleeve Shirt ,"Super quality, so soft material.
It worth at this price. Value for money",Amazon
Pinkmint Men Cotton Soild Spread Collar Long Sleeve Shirt ,Don't buy it's formal shirt only,Amazon
Pinkmint Men Cotton Soild Spread Collar Long Sleeve Shirt ,The quality is amazing,Amazon
SUPER GOLDEN Office Table ,"The SUPER GOLDEN Office Table is a versatile and practical choice for various needs. Its folding design makes it easy to store when not in use, saving valuable space. Whether you're working from home, studying, or simply need an extra workspace, this table offers a sturdy and functional solution. Its multiple uses and compact design make it a great addition to any home or office.",Amazon
SUPER GOLDEN Office Table ,"Good build quality and Comfortable.
Value for money.",Amazon
SUPER GOLDEN Office Table ,Nice product…,Amazon
SUPER GOLDEN Office Table ,Product is satisfactory so I need now 10 nos of this same product. So how I submit the order now. I try it but in the order list there are only 2 item have order for customers. I want order now. Thank you,Amazon
SUPER GOLDEN Office Table ,"This table is a perfect combination for keeping my tablet, my phone, bottle and the color is so beautiful…. Quality at this amount is so good….",Amazon
SUPER GOLDEN Office Table ,Broken corner,Amazon
SUPER GOLDEN Office Table ,"Less quality , not worth",Amazon
SUPER GOLDEN Office Table ,loved it .. size is very big according to price .. totally worth it,Amazon
SIHOO High Back Home Office Chair,,Amazon
SIHOO High Back Home Office Chair,,Amazon
SIHOO High Back Home Office Chair,"I have ordered 2 Sihoo M57 chairs and I am amazed by the overall experience.
The package was delivered on time, packaging was awesome and clean. The user manual has minimal 7-8 step process which can be followed to assemble the chair in approx 20-30 minutes.

The comfort level is great. The mesh is breathable so say goodbye to your sweaty pants.

The build quality is great. Steel and good plastic would make sure that it is durable. Handrests are quite accommodating and comfy with a little but soft plastic.

Con- Only a minor issue that i want to mention, the hansrest and neck support parts fumble a little but that is not a major issue as the chair is far better than any other chair brands in India.

As per my research, only Steelcase and Herman Miller offer better chairs but those are mostly not available in India and even if some models are available, they are like above 40-50k for a normal model. The HM that I liked was 1.2lacs 😂 so dropped the idea till i open my own business or become CEO of a firm 🤟🏻😎",Amazon
SIHOO High Back Home Office Chair,"The quality of the product is better than the other chairs sold in India with the same price range. Assembling the product do give a sense of achievement. Also helps u see each parts used and its quality.
I would recommend it if it is in ur budget even with its caveats.

Pros
1) lumbar support is padded and customizable. The reason i preferred this over others.
2) Being mesh do actually keeps u cooler. I tend to not need my AC, Only a fan can keep u comfortable.
The mesh don't irritate the skin. Mesh is of good quality
3) It doesn't creak at all (atleast my unit). Is sturdy even with the recliner. testament to its quality.
4) Only Chair i found sold in India with good Mesh quality being all mesh within the 15k budget. The
local brands are all selling it above 20k. Please keep this price.

Cons
1) Mesh seat even tho being flexible will not be as comfortable as a fabric cushion for some people. I am
not sure if it will sag by time. I work more than 12 hrs on the chair. My butt do feel numb but it is still
endurable for long use.
2) The armrest do have some wobble coz its can be adjusted. dont feel like its going to break but could
improve on it. Also i know its not 5D adjustable but wish the arms could be more narrower for me
since i am thin.
3) the leg arms do have edges that is not comfortable if i keep my foot on it. I can feel the metal blunt
edge. Could have some padding on it or make the design smother on the corner edge.
4) The recliner spring, I am not sure if the tension knob on the bottom even works or not coz i dont feel
any tension change on the recliner",Amazon
SIHOO High Back Home Office Chair,"Chair is built with good quality material. Back and bottom seat is made up of durable mesh resulting in good ventilation. Even though it's not recommended to sit for longer duration, I have noticed correction in seating posture and long duration comfortable work experience with this chair. Highly recommended.",Amazon
SIHOO High Back Home Office Chair,"Product is too good and quality is top notch it beats 30-40k range chair ,very comfort easy to fix .screw driver included with nuts .additional one screw is more .comfort is very very good not sure on the longevity as the chair is made of nylon strings or may be some other material .awesome quality of plastic and metal base .consort closed eyes who wants to do work from home and sit for longer hours .invest in your back",Amazon
SIHOO High Back Home Office Chair,"I generally review as soon as I bought the product in my initial impression

No doubt the product is comfortable and looks premium but here are some additional challenges.

After 6 months, I started noticing the oil leaking from Sihoo Chair and I emailed Sihoo for the same. There is no support in India.
The support I hot is from Hong Kong China.
They sent the Shocker and It caused so much trouble.
1 - your documents are required as KYC since the shipment you are receiving is from China. In my case they put my first name only for which I have to struggle alot, finally I was asked courier service to provide declaration of the name Sihoo added to the package
2 - The Product is stuck at Custom duty, when I reached out to Sihoo, they I need to clear that not them.
3 - despite of multiple follow up after that, no one is willing to listen in Sihoo
4 - Courier service is another trouble here, They keep on calling until your documents are not approved by their team and the custom duty fees is not cleared and because they charge you per day basis till the product is delivered to you ( beyond 3 days).

In short, Support is pathetic and if you come accross any issue, you are done.",Amazon
SIHOO High Back Home Office Chair,Overall good quality with good support for back and neck. Just sceptical about the mesh durability will see how long it will last.,Amazon
SIHOO High Back Home Office Chair,"Before buying this I hade a racing style gaming chair which are awful and this feels much better for my lower back, the adjustable back and head rest are a big hard tho but you get used to it",Amazon
SIHOO High Back Home Office Chair,,Amazon
SIHOO High Back Home Office Chair,,Amazon
SIHOO High Back Home Office Chair,"Semplice e utile! Dopo aver provato un paio mi sono trovato bene con questa!
C’è l’ho da un anno e non ho avuto problemi.
Non é una top di gamma ma molto robusta e comoda.",Amazon
SIHOO High Back Home Office Chair,,Amazon
SIHOO High Back Home Office Chair,"I was a little concerned that i would struggle with the build of the chair. It was very well thought out by company including providing gloves to use. This comes in handy when using the provided screwdriver to tighten all the screws.

One issue i did was was the casters are difficult to put in. However once i aligned the caster so that it was straight i was able to use my what to whack it...a bit painful on the hand but the chair is so strudy that its worth a 1 minute discomfort. Worst case let one of your kids do that part.

All in all happy with the comfort of the chair and the setup of the head rest which is quite flexible. Super comfortable and the color (i purchased the grey one) is very nice a little change from black.",Amazon
SIHOO High Back Home Office Chair,"It’s a great chair! Easy to put together, great for your back, nice and comfortable. All in all I I’m pleased with it.",Amazon
SIHOO High Back Home Office Chair,One of the best chairs out there. Bought one for myself years ago (older model) and purchased this one for my boyfriend's birthday. So easy to assemble. Literally doesn't even take 10 minutes. If you're debating buying this chair: BUY IT!,Amazon
MiNi CoOlEr,"I love how easy it is to use! Just add water, turn it on, and enjoy a fresh and cool breeze within seconds",Amazon
MiNi CoOlEr,"This mini air cooler is a game-changer! Perfect for personal cooling, it delivers a refreshing breeze even on the hottest days",Amazon
MiNi CoOlEr,"This mini cooler is an eco-friendly alternative to traditional ACs, consuming less power while still providing a comfortable cooling effect",Amazon
MiNi CoOlEr,"This cooler is perfect for bedroom or office use, offering quiet operation and effective cooling that makes a noticeable difference",Amazon
Baybee 2 in 1 Foldable Kids Playpen for Babies,"Visiting from Overseas and we got this portable cot for our son, arrived quickly and well packaged, also came with the mosquito net, only thing it needs is a mattress as the bottom is very hard.",Amazon
Baybee 2 in 1 Foldable Kids Playpen for Babies,My 2 Month old loves to sleep in this...easy to assemble...crib toys are nice n keep my baby busy (at least for some time :) ).... overall good product... thanks,Amazon
Baybee 2 in 1 Foldable Kids Playpen for Babies,"I am happy with the purchase , a bit overpriced. But babies have more space to crawl and play, it is a safe option for keeping babies when guardians are busy. Only point missing in design is that the vertical middle rods should be cushioned like the upper horizontal ones. My baby bumped his head on the vertical rod and it caused a small red contusion.
One can keep a small 5x6 mattress inside which gives cushion to babies while they learn to walk during initial years.",Amazon
Baybee 2 in 1 Foldable Kids Playpen for Babies,"Really happy with the product. Delivery was quick as well. This is Baybee Minihut. So far this is the only review available for this product. It is compact, strong yet lightweight, easy to assemble and dissemble, good quality and perfect for your newborn. I didn't want a cradle and was looking for something like a Playard. This is the only affordable product which meets all my requirements. Wish there was a canopy. Other than that, it's probably the best baby bed available.",Amazon
Baybee 2 in 1 Foldable Kids Playpen for Babies,My baby is loving it. Playard is quite big even parents can play along inside it with baby. Very useful where both parents are working. Value for money. Safety wise it's top notch. It has a cute appearance.,Amazon
Baybee 2 in 1 Foldable Kids Playpen for Babies,Spacious playpen for twin babies. Easy to put together if instructions are followed carefully otherwise quite a lot of elbow grease required! The walls are netted and supporting rods are on the outside so babies will not fall on them and hurt themselves...the floor of the playpen is slightly elevated so you may want to lay a playmat (like we have) inside to create cushioning between the base of the playpen and the floor.,Amazon
Baybee 2 in 1 Foldable Kids Playpen for Babies,It is very shaky & not uniformly sitting on the floor. I am worried to get it replaced since the replaced item could be equally bad. Someone could help fix this will be appreciated.,Amazon
Baybee 2 in 1 Foldable Kids Playpen for Babies,"As it’s difficult to be with the growing infant all the time , therefore to ensure her safety I bought this product for my 10 month old daughter. The Quality is 10/10, Easy to Assemble, Light weight but sturdy with a good suction power. Highly recommended for parents handling infants/ toddlers alone.",Amazon
