product_name,reviews,source
Oneplus Bullets Z2 Bluetooth Wireless in Ear Earphones with Mic,"There is nothing wrong with the looks of the Bullets Z2, they are actually quite decent looking. They are just a neckband, and this is what neckbands look like, and we have made our peace with it. The middle part is a thicker, slightly more stiff, U shaped-silicon band, with two chunky pill-shaped units at the end. The wires stem from these pills and have earbuds on the end. One of these pill-shaped units houses the battery, while the other has control options and the USB Type C port on the side. You get volume buttons on this control unit and a multi-function play/pause button. The battery unit has the OnePlus branding and the logo, while the volume buttons are highlighted in red.

The earbuds on the end are pretty standard, with eartips on one side and a flat back with magnets. When the buds are attached together, they will simply stop playing the audio, which you can resume once you put them back in. The Bullets Wireless Z2 are quite light and can be worn around the neck all day without ever feeling like a burden. The material used is quite skin-friendly and feels quite sturdy as well. It also comes with an IP55 rating.
Pairing the OnePlus Bullets Wireless Z2 is a pretty fuss-free process. All you have to do is press and hold the play/pause button, and the buds will go into pairing mode. You can then look up the buds in the list of Bluetooth pairings on your device and connect the buds. Once connected, the Bullets Z2 will connect to your phone automatically once you put them on.

You get the usual volume buttons on the buds and another button in the middle in terms of controls. Now instead of simply sharing the command load amongst its button comrades, OnePlus has put all the burden on this one button in the middle. Apart from the usual pairing/play/ pause/ call receiving/ call ending functions (which are already a lot for a single button), OnePlus has also made it responsible for changing tracks. You have to press the button twice to skip to the next song and thrice to go back to the last song. It may all sound simple but can actually be chaotic in practice as you have to keep track of how many times you have pressed that tiny button before the command is completed.

The OnePlus Bullets Wireless Z2 comes with the biggest drivers seen on a pair of OnePlus earphones- 12.4mm. The fact that OnePlus is offering such big drivers for under two thousand rupees is a major plus point for the buds. The earbuds support two audio codecs, SBC and AAC.

As for the audio performance, the Bullets Wireless Z2 are pretty loud and come with plenty of bass, something that seems to be every brand’s audio formula in the budget segment. While this kind of signature sound gives the audio some faux body, it actually fails to deliver what the audio is truly supposed to sound like.
If you are someone looking for a pair of earphones that offer balanced sound, then you might not like the sound profile that the Bullets Wireless Z2 offer as they lack balance, majorly.

That said, if you are someone who likes bass-heavy audio output and do not mind if some bass sneaks into your mids, then the OnePlus Bullets Wireless Z2 will definitely be your cup of tea.

The OnePlus Bullets Wireless Z2 were pretty good in terms of call quality. We could hear the speaker clearly, and we heard no complaints whatsoever regarding our audio quality while using the buds. As the buds fit deep into your ear canals, they offer really good passive noise cancellation.

They come with big 12.4 mm drivers, offer really long battery life, have a bass-heavy signature sound, and have a really solid build. But because the earbuds are really bass-heavy, they lack balance, and for those who like to listen to melodious or classical music, these might not be a great option.
The Bullets Wireless Z2 also face some heat from the likes of Oppo Enco M32 and the Realme Buds 2, which are priced in the same vicinity. The OnePlus Bullets Wireless Z2 are actually a great proposition for the price; you only need to have a liking for bass.",Amazon
Oneplus Bullets Z2 Bluetooth Wireless in Ear Earphones with Mic,"The OnePlus Bullets Wireless Z2 ANC is a budget-friendly neckband with strong bass, decent ANC, and a comfortable design. It offers up to 28 hours of battery life, fast charging, and an IP55 rating for dust and water resistance. While the bass-heavy sound may not suit everyone, it’s a solid choice for casual listeners.",Amazon
Oneplus Bullets Z2 Bluetooth Wireless in Ear Earphones with Mic,"Good quality, little bigger the end of the neck band because of a bigger battery. Sound and noise cancelation better than previous model. Ear tips smaller and lighter, for me hold really good even running, better bass and treble.",Amazon
Oneplus Bullets Z2 Bluetooth Wireless in Ear Earphones with Mic,"Bought these for the 2-3 hours a week I am at the gym and the battery life is good. The fit is good and the design is nice in my opinion, very slim and light weight. Despite the magnetic connection of the earbuds being the only way to power down the device this has not been an issue, they snap together and power down flawlessly. They are comfortable and the connection is the fastest I've ever seen and they connect to my S24 within a few seconds after separating the magnetic backs of the earbuds. Sound quality is decent, but the price and functionality has surpassed expectations as I've been using them for over 5 months and I've only had to charge them maybe once every other week for like 30 minutes.",Amazon
Oneplus Bullets Z2 Bluetooth Wireless in Ear Earphones with Mic,Ive trouble finding earphones that fit properly in my odd shaped ears. The neckband was chosen so I don't have to keep picking up my earphone off the floor!,Amazon
Oneplus Bullets Z2 Bluetooth Wireless in Ear Earphones with Mic,"The OnePlus Bullets Wireless Z2 earphones offer impressive value for their price, delivering solid sound quality with punchy bass, thanks to the 12.4mm drivers. The 30-hour battery life is excellent, and the quick charge feature is a lifesaver, providing hours of listening time with just a few minutes of charging.

Pros:

Sound quality: The bass is powerful without being overwhelming, and the mids and highs are clear.
Battery life: 30 hours of playtime is outstanding, and the 10-minute quick charge provides a substantial boost.
Comfort: The ergonomic design and lightweight build make them comfortable for extended wear.
IP55 rating: Water and sweat resistance make them suitable for workouts and outdoor activities.

The OnePlus Bullets Wireless Z2 earphones are a fantastic option for those seeking budget-friendly earphones with excellent battery life, comfortable fit, and impressive sound quality for the price. While they may not have all the bells and whistles of more expensive models, their solid performance and value proposition make them a great choice for everyday use.",Amazon
Oneplus Bullets Z2 Bluetooth Wireless in Ear Earphones with Mic,Bang for your buck!,Amazon
Portable Air Conditioners ,The quality of this fan is just amazing easy to carry anywhere great battery backup as well and speed of the fan is super awesome at this price its a must have product to buy just go for it.,Amazon
Portable Air Conditioners ,"I recently purchased this small personal air cooler, and I’m really happy with its performance! It’s perfect for cooling down my small room without taking up much space. The setup was super easyI’m really happy with this personal air cooler. It’s exactly what I needed for my small space, and I would highly recommend it to anyone looking for an affordable, portable cooling option.",Amazon
Portable Air Conditioners ,"This is really good and best product for summer usage i must say it's very much easy to use and helpful in summer too, quality is so good and colour is preety, value for money too.",Amazon
Portable Air Conditioners ,It is really good for individual in summer can be used for makeup or while travelling,Amazon
Portable Air Conditioners ,"Decent fan at decent price, good for one person working on desk or besides the bed.",Amazon
Portable Air Conditioners ,Quality is good best in use price is reasonable must buy it,Amazon
Portable Air Conditioners ,"Portable fan.It’s very nice. Comfortable, Noise level is low, Value for money, Fan speed/Air flow is good.
easy to operate.",Amazon
Portable Air Conditioners ,Worth it 👌🏻,Amazon
PAGALY Ultra HD Projector,Projector received but not working. It doesn't switch on if it connect to so that remote is also not connected,Amazon
PASLDA Wireless Carplay Adapter,"Works great on my 2017 Mercedes, very easy to install. Hey Siri works seamlessly, connects instantly every time so far!",Amazon
PASLDA Wireless Carplay Adapter,"I must say, I tried around 4 similar products available at Amazon and tested them diligently. Returned them all. Finally, my run to search for a wireless Android Auto dongle is over. Firstly I did not want to change my entire factory-fitted Android system. Secondly, I wanted to use the wireless Android Auto so I don't have to worry about getting into the car and then plugging the wire to start the Android Auto. It was a hassle, and inconvenient to do so every time. I have a 2019 Honda Amaze and am using One Plus 12 with the latest OS and patches. This device is working like a charm. There is zero disconnection lag or hang. Just work without any issues—full value for money. I hope the device lasts for a long. So far I am recommending the device.",Amazon
PASLDA Wireless Carplay Adapter,Its perfect with no delay and no disconnection i had purchased others before but i was facing disconnection issue and voice clarity issue but its purfect for my i20 asta 2021 model,Amazon
PASLDA Wireless Carplay Adapter,"This is the best choice for cars where wireless android auto is missing. It is working flawlessly. No wires to worry about. Price is bit high. Installation was very easy, takes minute to work on the first time, but then all is smooth. No reconfiguration required.
It is compatible for 2021 i20 models.",Amazon
PASLDA Wireless Carplay Adapter,The device works on playing music and maps wirelessly but not for calls. The other side is not able to hear anything and one is forced to switch to phone speaker instead of blutooth. Using on Kwid 2024 model with Nothing Phone 1 having latest Nothing OS.,Amazon
PASLDA Wireless Carplay Adapter,"Not a PASLDA brand product.
Came in a generic no-brand package with made in China slogan however working as per expectation.",Amazon
PASLDA Wireless Carplay Adapter,I visit multiple car decor shops but not helpful this product is good and I am able to connect my media player without any wire connection it supports both my apple and android mobiles,Amazon
PASLDA Wireless Carplay Adapter,"Received it yesterday. The first impression is that it’s an excellent product. Will update after using for some more time

Downloading the rating after using for 3 days. The connection drops for some reason especially during a call. Happens atleast once during a drive.",Amazon
PASLDA Wireless Carplay Adapter,"I purchased this touchscreen car multimedia last fall, and it has exceeded my expectations! Setup was incredibly easy—just plug it in, and it’s ready to go. No complicated wiring or tools required. The touchscreen is bright, responsive, and user-friendly, making navigation effortless.

I use this exclusively with Apple CarPlay, and it works flawlessly. The wireless connection is seamless, allowing me to access maps, music, and calls without any issues. One of the biggest advantages is its portability—I can easily transfer it between cars, which is a huge plus.

I haven't installed the backup camera yet, but even without it, this device has been a fantastic upgrade. If you're looking for an easy-to-use, portable CarPlay screen, this is definitely worth it. Highly recommend!",Amazon
PASLDA Wireless Carplay Adapter,"I kinda bought this on a lark to see if it could improve -- and make safer -- driving our 2009 Camry, especially for my kids who are learning how to drive.

I also bought a license plate mount for the backup camera, and I bought a different kind of mount for the head unit so that I could hook it into my AC vent (getting it to stick to my dashboard was not going to work longer term with a car that sits outside in the Texas summers).

Long story short, it connected to my phone almost immediately, and it works very well with Android Auto. And the backup camera is also very good (my wife was impressed with the image and said it is better then the built in backup camera in her Honda CRV).

So, overall, very happy to rate it 5 stars. Assuming it holds up, worth the money spent and time it took to setup and install.

Here are some specific pros and cons and considerations:

Pros:
* It does what it says it will do and it does it at a very reasonable price.
* Very bright, crisp images on the screen.

Cons (these are all minor):
* Touch screen seems an iota slow. Not terrible, just about 1/5th of a second slower than my phone, for comparison.
* Built in speakers are OK, but not great and certainly not built for high vol.
* Cord for the backup camera was about a foot short for how I wanted to route it, but it was long enough to route it under my front seat (which was my second choice).
* Instruction manual gets a B-. Far better than most instructions manuals coming out of China, but could be better.

Considerations:
* Backup camera installation is not hard if you know what you are doing and are comfortable pulling wires through cars, etc. There are some good videos on YouTube. Watch them carefully and think through how you are going to do it before you start. If you have the correct tools and are comfortable doing this kind or work, should take you about an hour at most.
* You likely will need to drill a small hole for the backup camera wire. Be thoughtful about how to do that (there may be two walls you have to punch through), and use grommets or tape to make sure the sharp edges where you drill the hole don't eventually slice through the wire's insulation from the vibration of driving.
* Also have about 10 small 'zip ties' for securing the wires so they don't get pinched some day.
* As noted above, I do recommend a different way to mount the head unit than what comes with the system, and a different camera mount.
* Lastly, you are going to have some cables running to the unit, so have a plan to manage them so they are not in your way while you drive and become a hazard or look unseemly.",Amazon
PASLDA Wireless Carplay Adapter,"Fast shipping, arrived as described. Setup was super easy and connects by Bluetooth quickly. I put it in my 2007 Ford Focus and works like a charm. I use mine over the car radio, no complaints on sound. It’s not Ultra High Def sound using this method but I have no complaints. I am thinking of buying one for another old work car that I have.",Amazon
PASLDA Wireless Carplay Adapter,"This is exactly what I needed! I love playing music on my phone in the car, but my car is old enough that it doesn't have a Bluetooth connection feature, and the regular phone speaker doesn't go loud enough for me. This allowed me to be able to play my music and hook it into the car speakers through the cigarette lighter port. It has also been great when I am driving, instead of having to try and look at my phone at stop lights I can easily see this screen out of the corner of my eye on the dash to make sure I am still on thr right path. In addition to that, it can read my texts to me, and I can click the speaker button and talk to respond to texts handsfree. 10/10 reccomend! I feel like it has made me a safer more efficient driver, and it is so easy to use. Just plug in to the car, press the power on button, and open Bluetooth screen on your phone and select the car play option and you are ready to go!! Only piece of advice I have is to stick the mount on a warm day. I messed up not thinking about it, and stuck it on a 20 degree day. It didn't stick, and fell so I had to buy more adhesive for it. As long as you don't make the mistake I did you will be fine. It is a great quality product, easily fits on dash board, and makes my life so much easier.",Amazon
PASLDA Wireless Carplay Adapter,"After purchasing two of these units from a different seller and returning both due to issue with the audio I found this product to be in great working order.

""Wireless"" is a misleading name for this product. It does connect wirelessly to your phone via Android Auto or Apple Carplay. But there are a lot of wires involved! there is a separate wire for power, auxiliary audio, and the backup camera. You will likely have to drill a hole in your truck/hatch for the backup camera wire. And connecting the camera wire to your reverse light is not intuitive or easy. You have to strip a little of the wire, find the positive wire of the reverse light, and connect the two wires in some way. I put the camera wire into the housing of the light fixture and made the connection that way. The instructions are super basic and leave lots of room for interpretation.

Once I installed the camera and screen, hid the the wires under the plastic paneling and floor mats I was pleased to find that the screen works great. The functionality is just what I was looking for. Once I connected my phone to the unit via Android Auto I was able to use my apps via the touch screen. And every time I gat in the car my phone automatically connects within 30-60 seconds.

The backup camera is low quality. It works fine in daylight but is pretty much worthless at night.

A note on the audio: you have to select ""auxiliary"" in the audio settings for it to play through your car speakers. It won't automatically play through the aux cord when you plug it in. But I only had to do this once, audio plays through the aux cord automatically every time I get in the car.

Bottom line: you get what you pay for. This is a very affordable upgrade to your old car.",Amazon
Classmate Short Notebook,"I am return the product
I want refund my amount.",Amazon
Apsara A4 Size Long Notebook ,"I ordered what was advertised as a pack of 12 Apsara A4 Longbook29.7x21 Pages 96 Single Line, but to my disappointment, I only received 01. The listing was clear about the quantity, so this feels like a significant oversight or scam. I reached out to customer service, but it’s frustrating to deal with such misleading information. I strongly advise others to double-check before placing an order. Be cautious!

Rating: ★☆☆☆☆",Amazon
Apsara A4 Size Long Notebook ,Received in good quality and in time,Amazon
Apsara A4 Size Long Notebook ,"Value for money, received sealed pack of 12 notebooks. Same as shown in the pic. Thanks Amazon 😊",Amazon
Apsara A4 Size Long Notebook ,Ordered pack of 12 notebook but received only 1 notebook,Amazon
Apsara A4 Size Long Notebook ,I received only 1 notebook instead of 12 notebook.,Amazon
Apsara A4 Size Long Notebook ,Paper quality and binding of the book is very good. Value for money.,Amazon
Apsara A4 Size Long Notebook ,1 received only,Amazon
Apsara A4 Size Long Notebook ,"Good quality note books
No ink spill",Amazon
Baybee Run Battery Operated Jeep,Nice packaging...The product is of good qauality..working really good.,Amazon
Baybee Run Battery Operated Jeep,This is an amazing product. We have tried this and my baby loves thid,Amazon
Baybee Run Battery Operated Jeep,"Pros:
- Solid built quality and premium feel. Not any kind of cheap/thin plastics you normally find.
- Item arrived in a very good packaging. Easy to assemble. The instruction manual is pretty clear and the assembly took about 30 min.
- We have only used remote controlled driving as of now and it works great. Easy control and works as intended.
- Works on tiled indoors, outdoor with interlocks as well as lawns.
- It seems you could drive around 45min-1hour with a full charge though we haven't allowed battery to go down to lowest level yet.

Cons:
- At this price, the car is missing a few bling. Doors are not openable. No rear lights. No Aux/USB ports for music, only the built-in boring tones.

Overall, my kid loves it and I'd give it a 4/5.",Amazon
Baybee Run Battery Operated Jeep,It is a good product worth ordering. But a small hiccup was there that two pieces of screws were missing.,Amazon
Baybee Run Battery Operated Jeep,"We opened the package after 5 days of its arrival because we were unable to open it earlier. Unfortunately, by the time we opened it, the return option had expired. When we assembled the parts, we discovered that the remote control had a rusted battery inside.

Default piece - Instead of NEW sent an used non working product",Amazon
Baybee Run Battery Operated Jeep,This was a good find and a good purchase. Everything about it is good. My kids liked it.,Amazon
Baybee Run Battery Operated Jeep,"It's a damn awesome product by which my nephew is delighted by driving it.
I thank BAYBEE to invent and manufacture more products in the future with updated technology.
All the best.
Good luck!!!
Regards,
Joshua.",Amazon
Baybee Run Battery Operated Jeep,"It is really nice.. the only two drawback is No doors, nd No USB music..",Amazon
Giordano Fashionista Collection Analog Bracelet Wrist Watch,i like the stap design and looking for white dial within my budget. got the perfect watch.,Amazon
Giordano Fashionista Collection Analog Bracelet Wrist Watch,Beautiful rose gold shine. The look is very decent.. Goes with any dress n occasion. bit worried about the lasting of the colour.,Amazon
Giordano Fashionista Collection Analog Bracelet Wrist Watch,"The product came as described and was looking good. The watch works fine and one of the only issue was the clip was a bit loose. Got it fixed easily, but before that it fall once as the clip was loose. Overall a good purchase.",Amazon
Giordano Fashionista Collection Analog Bracelet Wrist Watch,Its a classy watch..Go for it!!,Amazon
Giordano Fashionista Collection Analog Bracelet Wrist Watch,"With such cost too poor quality, not recommended to buy this.",Amazon
Giordano Fashionista Collection Analog Bracelet Wrist Watch,"I bought this for my mom bday n guess what she loved it too much,,,,it looks fab",Amazon
Giordano Fashionista Collection Analog Bracelet Wrist Watch,Hope the color of the watch strap doesn't wear off this time,Amazon
Giordano Fashionista Collection Analog Bracelet Wrist Watch,Good product,Amazon
Blue Heaven Cookie & Souffle Matte Lipstick,"I ordered this and i was impressed by the packaging. And when I tried the lipstick the first wand it felt so lightweight and airy, just like mousse. The texture is amazing and shades are perfect for brown skintones. I would say its a definitely value for money. It is matte finish so its not smudge proof. Stays for longer time. Might have to reapply after 7 hours. Overall great product.",Amazon
Blue Heaven Cookie & Souffle Matte Lipstick,"I usually see the reviews before buying and ig most people do the same!! So this is for those people who are search a review to know about this product..

This lipstick's packaging is outstanding 💯.
It has a creame texture no shine at all. It stays for as long as you wipe youe lips really hard... Quality is top notch. And yeahh you don't feel like you are wearing a lipstick..it's very light!!✨
There are many shades so choose accordingly and I am in love with this product thankss to Blue heaven.",Amazon
Blue Heaven Cookie & Souffle Matte Lipstick,I've been using this for last 4 months and this one became my favourite. The colour is soo pretty omg and the texture feels so soft and hydrating. The best lip product in such an affordable price range. And girll it smells like chocolate too (yummy) .,Amazon
Blue Heaven Cookie & Souffle Matte Lipstick,I ordered the shade chocolate martini and it is the perfect pinkish brown nude shade for dusky skin tone. It is not transfer-proof though.,Amazon
Blue Heaven Cookie & Souffle Matte Lipstick,There is something wrong with the product.. it seems a bit off,Amazon
Blue Heaven Cookie & Souffle Matte Lipstick,Highly pigmented. It transfers even after an hour of applying. A weird smell too.,Amazon
Blue Heaven Cookie & Souffle Matte Lipstick,Great colour shade and texture. Keeps your lips moist and feels sooo buttery smooth on application. I must buy product. I wish I could have all the shades.. they are all so full of cookie chocolatey and coffee fragrances!! Love them!!,Amazon
Blue Heaven Cookie & Souffle Matte Lipstick,,Amazon
Blue Heaven Cookie & Souffle Matte Lipstick,,Amazon
Blue Heaven Cookie & Souffle Matte Lipstick,"Not nude for fair skin people. Looks same when swatched on hand (warm tone brown) but on my lips it appears reddish pink and after few hrs turns pink. Takes 30mins to settle down completely and smudges a little. Staying power is good upto 5-6hrs without eating. Applicator is comfortable to apply. Will suit wheatish to dusky skin tone as a nude lipstick. Fades away leaving tint, won't look disasterous.",Amazon
Pinkmint Men Cotton Soild Spread Collar Long Sleeve Shirt ,Good,Amazon
Pinkmint Men Cotton Soild Spread Collar Long Sleeve Shirt ,Not good,Amazon
Pinkmint Men Cotton Soild Spread Collar Long Sleeve Shirt ,NA,Amazon
Pinkmint Men Cotton Soild Spread Collar Long Sleeve Shirt ,"The quality of fabric is good and really comfortable to wear.
Shirt design also good we can wear it with jeans as well formal pant.
Value for Money❤",Amazon
Pinkmint Men Cotton Soild Spread Collar Long Sleeve Shirt ,"I feel so... Regret for purchasing this product through Amazon app ,
The photo which they have shown in the app is too much different from the reality ,
Ever ever expend ur money for buy this product ...
I feel so regret ...",Amazon
